id,date,lat,lng,name,score,text,title,user
review_620611387,2018-09-29,42.691116,23.312674,Casa Ferrari B&B,100,"Cassa Ferrari is a lovely traditional style b&b in a great location for exploring Sofia. Ludmill the owner is really friendly and knowledgeable. He genuinley wants his guests to have a good time, which we did. We particularly enjoyed our trip with Ludmill to Rila Monastery and Boyana church. We would recommend staying here to our friends and family. Emily and Steve",Very happy with our stay,E9AA3398FD2438316BC5EE2357226354
review_618431127,2018-09-21,42.691116,23.312674,Casa Ferrari B&B,100,"Centrally located (lots of very nice shops, restaurants and cafes nearby, if you know where to look- Bulgarians very impressed by the location.A lovely, hospitable host who cannot do enough to help visitors.Clean, tidy and well-run.Kitchen facilities available and extras, like a hairdryer.",Hospitality in buckets!,AD851FA101D76668B21056695F62FAE4
review_607824744,2018-08-18,42.691116,23.312674,Casa Ferrari B&B,100,"We have stayed here several times and feel so comfortable at Casa Ferrari!! The rooms are comfortabl, clean and air conditioned, breakfast is great. It is easy to get around to the center of Sofia and Ludmill will help guide you to whatever you would like to do around Sofia or other parts of Bulgaria. A most gracious host and as many have said goes out of his way to make your stay the best possible in this lovely B&B.","Ludmill is a wonderful host at this clean, comfortable home away from home.",5C8CB075B42877AB4DDDF719C05250E8
review_605894127,2018-08-13,42.691116,23.312674,Casa Ferrari B&B,100,"Other reviews have already mentioned what the property looks like, its location etc. But I want to focus on Ludmil. Not only is he the part owner, but he's the friendliest host I've ever encountered, whether in an airbnb setting or a hotel setting. He always has a smiling face and a can-do attitude. There is nothing that he wouldn't mind doing to make your stay more enjoyable and comfortable. We needed to keep the room for a few more hours to freshen up on the way out. No problem. We needed to be picked up at the airport as we were not renting a car for the one day we were spending in Sofia. No problem. We needed a ride to the bus station when leaving. No problem. We had questions about food and local transportation. No problem. We wanted to learn about the city and the country - Ludmil made a very information presentation on the history of the city and the country on our way over to Casa Ferrari.Bottom line: We would stay at Casa Ferrari just to spend time with Ludmil (all other reasons notwithstanding)!",Ludmil is the man!!,C5C4A8239B6DB1219839DF3C6FD579C6
review_603245627,2018-08-06,42.691116,23.312674,Casa Ferrari B&B,100,"The location is walking distance from many of the major downtown sites -- we never had to drive or take taxis. The B&B is on the ground floor of an apartment building. We had a large room with high ceilings, hardwood floors and oak furniture, plus a comfortable private bath.The proprietor was very helpful and pointed us, immediately, to a free walking tour that helped orient us to Sofia and let us plan out the next day. Like most other things, we were able to get to the walking tour on foot.Everything is clean and comfortable. We can recommend highly.",Enjoyed staying at this homey b&B,4D3CB250C78782B1F63232E7E42398A5
review_589996443,2018-06-23,42.691116,23.312674,Casa Ferrari B&B,100,My daughter and I have just stayed here for 2 nights. Ludmil is a wonderful host and nothing is too much trouble. He has an excellent knowledge of the area and the history too of Sofia. The room was very comfortable and breakfast was traditional. Highly recommended,Wonderful,422DC38DDE4289A8CDB3E9020FB6DFA7
review_586063322,2018-06-08,42.691116,23.312674,Casa Ferrari B&B,100,"My wife and I decided to visit our native country Bulgaria this year. After being in USA for 24 years and post previous visits, in average of once in 3-4 years, we were expecting to become better and better in many aspects of life. And we were right. We found Casa Ferrari, a cosy nice B&B hotel in central part of Sofia on a quiet street. It is a super place to be. You feel like at home. Rooms are simply perfect. The entire apartment place is with all necessary things to maintain a nice and relaxing stay. The service of Mr. Mandichev is world class. Professional, responsive, polite, helpful. Ludmil is doing superb job. He picked up us from the airport with very nice modern car and in no time we have been in the beautiful room to rest from the long trip. No hassle with taxi drivers that are generally nice but could be an unusual trip (no fresh air in the car, not finding the place right away, etc.). With the manager and owner of the place we got no waiting for taxi and we were sure he will not take a long road to the hotel. The place is located in a very good heart part of the capital. Easy connections are available by public transportation as well. There are nice pretty restaurants in a walking distance too. When you need taxi just pick up the phone in the hotel no need to remember a number, press a button and the dispatcher replies and the taxi comes in 3-5 minutes. I am so glad we found that place to stay.And as usual when you travel unexpected things happened. This time I forgot my cell phone in the place after leaving it and already locking it with the keys inside. We were in a hurry and had to travel to a different town for a day. Next day Mr. Mandichev was waiting for us at a convenient place in the capital with my cell phone. My trip was saved. My whole vacation was good. Now I know where to stay when I go to Sofia. The answer is simple Casa Ferrari. This place deserves 9.8-10.0 Thank you!!!",Visit Sofia and feel like being at home,7548FC068B2C935321388C20C5046211
review_575840288,2018-04-26,42.691116,23.312674,Casa Ferrari B&B,100,"Ludmil is a very interesting person, an excellent guide for the culture and history of Sofia and Bulgaria. His property is in an excellent location. And his bed and breakfast accommodation appears to attract fascinating people.",A good guide to an interesting town,BE2F3154FF674B38061E872CF7F4668F
review_574715513,2018-04-21,42.691116,23.312674,Casa Ferrari B&B,100,"Thats why it deserves 5 stars. Owner is very kind and helpful and also knowledgable. Rooms are super clean, with all the necessities and very nicely furnished. I enjoyed my short stay and would come back again.",It is exactly what it says it is,0AD365ECEB41DA36D719A9542DD259A3
review_557858946,2018-02-01,42.691116,23.312674,Casa Ferrari B&B,100,"Casa Ferrari B&B is a cosy and comfortable B&B in the heart of Sofia. From day 1, the owner, Ludmil has been fast and responsive in his communications to me. I got to know that Ludmil provides pick up service at a reasonable price and since we arrived very late at night, Ludmil was already waiting for our arrival at the airport. Ludmil does not stay at the B&B but nearby. The B&B is very clean and cosy with beautiful italian styled furniture. The room and bathroom is spacious. Coffee and tea is always available and you can make it yourself at the kitchen. Ludmil also provides wonderful breakfast everyday and chats with us while we are having our breakfast. He's very knowledgeable and we have enjoyable and lively conversations with him. The B&B is walking distance to 2 different metro stops and you can also walk to almost everywhere as well. The main shopping street - Vitosha Boulevard is around 15 mins away by walking. The B&B is in a quiet but secure lane. You have to have a pass to enter the building and then a key to enter the main door of the apartment and finally a key to your room. We enjoyed the walks from the B&B to the sights. Along the B&B, there are food shops and small shops selling knickknacks. Ludmil is always there to provide assistance and information should you need it. He can also take you on day trips to Rilla Monastry. Our flight leaving Sofia was late night and Ludmil kept our luggages at the main area as there was already a guest coming in the afternoon.We enjoyed our stay and hope to stay again at Case Ferarri in the future.",Charming and cosy,2590F3E3E4B1385C1260440C3BC31C7E
review_631570850,2018-11-07,42.677124,23.322142,Magic Castle Hotel,100,I have stayed at this hotel seven times and have booked again for a future visit. Rooms comfortable with English language TV channels. Breakfast is basic and served with a smile. The hotel is a very short walk to the European Union Metro station.There are places to eat and drink nearby.On the opposite side of the main road is a smart shopping mall.,A REAL WELCOME,4DAB41E307719916956321603D476288
review_630341908,2018-11-02,42.677124,23.322142,Magic Castle Hotel,100,"This is small but excellent hotel in the capital of Bulgaria. The location is perfect, near to National palace of culture and subway station. Cleanliness is ten of ten, personal is very polite and helpful. The rooms are spacious. There is a restaurant. The menu is not so varied but dishes are delicious. I highly recommend this hotel for business trip or even if you travel with child.",Small jewel of Sofia,3B104C47BE4DE787EDEDB274B4C171C6
review_617918167,2018-09-19,42.677124,23.322142,Magic Castle Hotel,100,"Recently stayed at the hotel.Cannot really find a fault. New, clean, very quiet fridge in the room, great smoking policy, shower excellent, safe in room; bed comfortable, great Otis elevator; breakfast satisfying; on the Sofia Metro line. Excellent customer service. Will stay here again when in Sofia.",Best hotel in Sofia,3251612853ADACB4A90E5E3512575408
review_617617959,2018-09-18,42.677124,23.322142,Magic Castle Hotel,100,The hotel is about 15 min walk to the center. Decent amount of drink and food options around. The room was very nice and clean and quiet. WiFi worked well as did the ac. Parking was an additional 7 euro. Staff very nice and good breakfast as well.,Very nice.,63ECDABDA4925E5038FC325363EC6B38
review_616403321,2018-09-14,42.677124,23.322142,Magic Castle Hotel,100,"Stayed in this hotel for 5nights in June, with a party of 4.Nice clean single rooms with all the necessary amenities. Close to the City centre, only 2 metro stops, tube entry at less than 100m.Very friendly and helpful staff. Nice restaurant with local dishes if you are too tired to dine out.","Charming little hotel, with execellent and friendly service",CBD2D2196F95EA8DBA0D7DE452FF82CA
review_614477096,2018-09-06,42.677124,23.322142,Magic Castle Hotel,100,"I keep returning here every time our family visits Sofia and now it is our ""home"". The amazing hospitality of the hotel staff and owners is rare. The place is perfectly maintained, the breakfast is wonderful with a perfect variety for a healthy start of the day, the breakfast room is also very inviting. We always look forward to our next stay!",Consistently the best hotel to stay in Sofia,B2D05CF60A053180C1605BF70627FD9C
review_611930677,2018-08-29,42.677124,23.322142,Magic Castle Hotel,100,"friendly, clean and the best coffee ever in a hotel! We stayed two nights, very close to Metro stop and Park Shopping Centre complex. It is on a busy road but we were in a room at back of hotel so not too bad, Rooms are big, well furnished, kettle, fridge and stand alone aircon unit. Bathroom really clean and shower very good. the only issue were the pillows were very solid! breakfast good with home made cakes and we left early on final day and a pack up breakfast and coffee to go was provided, excellent customer service at 5am in morning.",perfect boutique hotel,A9FF002FB03F66B1EFF239F767E0C8BB
review_611903017,2018-08-29,42.677124,23.322142,Magic Castle Hotel,100,"The hotel is very clean, pleasant and comfortable. The staff are helpful, friendly and welcoming. A great effort is made in making you feel at home, breakfast is very generous and tasty.It is very easy to get to town or to the out skirts of Sofia using public transportation, their bus and underground service is fast and very easy to understand. So the Magic Castle Hotel is a good choice and I think you will enjoy your stay.",My stay in the Magic Castle Hotel,A5B9B10E5B50A6EB49D4B7837272D949
review_610117970,2018-08-25,42.677124,23.322142,Magic Castle Hotel,100,"This a very nice family run hotel. On arrival, there was valet parking. Room was spacious and the bed was very comfortable. Breakfast was good, with many home madr pastries. The staff was also very polite. Location is excellent, walking distance from city centre and right on the metro stop as well. I highly recommend this place and I will come back in the future.","Great family hotel, great location",4B4CF8290532083FE5043C169539A8E2
review_610075560,2018-08-24,42.677124,23.322142,Magic Castle Hotel,100,What a beautiful hotel. Our room was a lovely size with a large separate bathroom. Staff on reception were very friendly and accommodating and explained everything about the area and tourist information. Breakfast was amazing. Close walking distance to the metro and beautiful boulevarde.,Don’t go past staying here,3F63ACD85A45CD9149C587A69222E40C
review_636965742,2018-12-01,42.658978,23.383108,Novotel Sofia,100,We stayed 2 nights at this hotel. Rooms were clean and provided all the comfort and amenities necessary for a comfortable stay. Hotel provided handy shuttle bus from the airport. The mall is just a few minutes away from the hotel. Thanks to Plamen and Kuber for organizing my day off to explore the city.,Incredible city,3B55EB6CA65FD4C57CCA02BC256294CB
review_636054502,2018-11-27,42.658978,23.383108,Novotel Sofia,100,"I recently stayed at this hotel. The room was very modern, clean and spacious and it had tea/coffee/iron facilities, which is a bonus.Great variety of options at breakfast. Big shopping center 50 metres from the hotel and cheap taxis to the center.Fast chech in and check out, friendly staff, special thanks to Polina and Sabina.Would definitely recommend staying here.",beautiful hotel,FE2801CA90139F18A827D5A86902F848
review_635864612,2018-11-26,42.658978,23.383108,Novotel Sofia,100,"I travelled with 4 colleagues to Sofia for a week's business trip. The booking was quite convoluted with several changes and the hotel staff were extremely accommodating to all requests.As expected, the standard of accommodation was very good; we had booked a mixture of Standard and Executive rooms, and I was fortunate to be upgraded to a Suite, which was very useful as it allowed us to hold a couple of impromptu meetings in the spacious lounge area.Breakfast was quite varied and of a good quality; we ate in the restaurant twice and the revised menu was varied and the food of good quality.",Another Business Stay in Sofia,6B7EEF37BBFD3EA3E7208DD19445FA3C
review_635440086,2018-11-24,42.658978,23.383108,Novotel Sofia,100,"I was in a wonderful wedding in Novotel.I want to say very thank to Lily, Yavor, Niki, their professional service was excellent.The staff from kitchen Bobi, Olia, Trayan are amazing chefs. SPECIAL THANKS",Wedding day,6636458B1351A601BCC762D2A116EC4B
review_635208554,2018-11-23,42.658978,23.383108,Novotel Sofia,100,"I have collegues who visit the hotel very often for lunch becouse our office is situated nearby. They shared with me their good opinion for the hotel and the food and yesterday I visited it too. I was really impressed first of all from the hospitality of the staff - the welcoming smile of the bartender Mira who made me a great lemonade, the profesional skills of managers Vladimir and Daniel and the waitress who has cleaned my table - Iliyana. The food was really delicius - there is salad buffet with a big choice of fresh salads and soup only for 7 BGN!!! I will really start to have lunch in Novotel very often! It's much better and cheaper from the mall.Thanks to all restaurant and bar staff! See you soon!",Amazing lunch,F1AE122C9AFBAB34A2C25A40634380F4
review_635188810,2018-11-23,42.658978,23.383108,Novotel Sofia,100,I stayed at Novotel for two days. The hotel location is great MY office is Just five munites wolking distance from The hotel and also there is very big shoping center Just next door. THanks to Ivan and Apostol Who manage to help me to arrange a massage and recomind me a very tasty resturant at The city center,PDRFECT,7F7D06E1037F01871A014F58A5EBF050
review_635130322,2018-11-22,42.658978,23.383108,Novotel Sofia,100,"I loved everything about this hotel. The location just cant be beat, everything you need is within easy walking distance or you can get a taxi to go downtown, but at the same time it was on a busy street. The room was great and the hotel has a smoking terrace where you can smoke! The bed was comfy with nice linens and there was lots of hot water in the bathroom. It wasnt fancy but it was clean and comfortable. I ate in the cute restaurant twice, they have a large menu and finding vegetarian options was easy, the service was friendly. Breakfast was great ! I stayed for 6 nights and the service was first class, I was greeted by name every time I appeared in the lobby and Svilen, Peter P. Kubar and Peter P. always asked me if I needed anything and if everything was OK, nothing was too much trouble fo them to help me with. I needed breakfast a little earlier on a couple of days because I had an ealry flight, it wasnt an issue at all. I would love to go back here one day.",You should stay here!,CC5BF6CA795B7CE101CBDE1A16C79F49
review_634912316,2018-11-21,42.658978,23.383108,Novotel Sofia,100,"I stayed in an executive room on the top floor and it was brilliant from check in to check out the staff were great.They checkin was welcoming , specially Peter S. And Kuber from the reception, they were extremely friendly and supportive during the whole stay.The room was super clean and the bed comfy. The mini bar was brilliant!I had room service which was great and we priced as well as breakfast which had options for all.The bar area was also great for a drink and snack. I love the cocktails made by Rumen.The conference facilities were impeccable with brilliant snacks at the breaks too!I would strongly recommend for anyone who needs to be near the airport!",Brilliant staff,89B908D84834A3BEF744ACD3643A940B
review_634854235,2018-11-21,42.658978,23.383108,Novotel Sofia,100,"I come to Sofia practically every month and stay here. Every time everything is very convenient. I like the rooms, breakfast is really tasty with good selection of food, very comfortable transfers from/to the airport. The staff is very friendly and nice. Thank you very much and see you soon!",One of the best hotels in Sofia,198E5A62BD1874D7BA1E7C0D6CC18892
review_634838094,2018-11-21,42.658978,23.383108,Novotel Sofia,100,"Fantastic. Really I can recommending this hotel as place with easy access , wonderful staff along with all the delights you would expect. Extremely well priced . Excellent Resturant and an extremely friendly lounge bar . (Thank you Mira,Iliyana and Daniel for the best service ). Hope you all will have as good a stay as myself.",Dream hotel,3A63A1482F26259236B39E764BA1BAE9
review_631325583,2018-11-06,42.70669,23.321758,Hotel Favorit,100,Well done to staff and owners..very good and well managed hotel with large and clean rooms and very helpful and well manered and nice staff. Breakfast is above average and location is 15 to 20 min from the Center in a cab,Very good hotel,A5B3E3BAB9F50D0B492DBB7ED304C577
review_631146203,2018-11-06,42.70669,23.321758,Hotel Favorit,100,"We have no complaints at all with the hotel.The staff are very good and helpful.Our room was a deluxe with balcony and was spotlessly clean and spacious.The breakfast was also satisfactory.However, the area in which the hotel is situated is not pleasant.Also it is a long walk to the centre.You can get a taxi from the hotel to the centre which will only cost about 5 lev(less than 3 euros).The same hotel in the centre would be perfect !!!!!",The hotel is very good but the area isn't,F53B862459B5A8978B901DDA0837EE13
review_627962193,2018-10-24,42.70669,23.321758,Hotel Favorit,100,"Very charming hotel, on an exceptional location - a quiet environment, and close to all the attractive amenities that can be reached by foot.The room is spacious, equipped with a coffee maker and excellent offer of TV channels, especially music, which, as a rule, are rarely found in other hotels. Breakfast is diverse, with a selection of hot dishes, fruits and cakes.Extremely friendly staff.Greetings to young Mr. Plamen, who helped me during the problems I made during my online booking.",Very charming hotel,92DE83DE3B91051B147826CC6386A66D
review_622838356,2018-10-07,42.70669,23.321758,Hotel Favorit,100,"Fabulous stay here. From the moment we arrived and were welcomed by the charming receptionist, to the day we left, we were most impressed with this hotel.The room with the huge balcony was fantastic with plenty space to relax in (perhaps the shower room was a bit small). The meal we had when we arrived was excellent and so were breakfasts. Close to the train station and an easy walk into town. We would thoroughly recommend this hotel and would have no hesitation staying here again.",Capital trip,9C93937120519B8B97D37A9D1769B8C4
review_622526501,2018-10-05,42.70669,23.321758,Hotel Favorit,100,Nice small hotel off the main blvd. Great location and minutes from all by taxi. Staff was very very polite and also friendly. The room was a twin with desk and sofa. Shower with very strong water pressure. I recomend for a quick stay.,Excelent & Affordable,1FE48F25252C78BE46FE7834543A6D54
review_619825737,2018-09-26,42.70669,23.321758,Hotel Favorit,100,"I went there few times just for a night and it has always been a pleasure. The place is clean and people really try to help you if you need them.The breakfast is also good, you'll find anything you want. The price is really interesting, it worth it.",Nice and Clean,5EF6F9729A45B0816BF7BDD68A975B50
review_615005617,2018-09-08,42.70669,23.321758,Hotel Favorit,100,"Nice hotel located in a small quiet street next to the lions bridge , so 10 minutes away from the city center. Hotel is small but comfy and breakfast is fine for this standard hotel. Rooms are not soundproof so you can hear sounds from time to time. But this hotel is a good value for money for a few days .",Nice hotel next to the lions bridge,DF42891C1DB0ADB27477EAD7EEF9D2EC
review_612835345,2018-09-01,42.70669,23.321758,Hotel Favorit,100,Stayed here three nights. On a quiet street about a 5 Lev cab ride to Vitosha Blvd where all the shopping and restaurants are. We were greeted by Lilly at the front desk she was personable and very professional. When we told her were parked out front she offered to take care of the two hour parking by keeping our key and placing the stickers in the car so we would not get a ticket. I would highly recommend Hotel Favorit because of Lilly!,Awesome!,E230FD9C9B1E4E86AF003BAD15133A61
review_608417575,2018-08-20,42.70669,23.321758,Hotel Favorit,100,"Hotel was comfortable, clean and reasonably well equipped. Staff were attentive and helpful. Breakfast was plentiful and varied. Location outside of the main city centre was ideal for Bus and Train stations and we enjoyed the short walk to the Lion Bridge and beyond.",Ideal base for a short stay in Sofia,66D368D2B307A42AE5D55C2750C2A462
review_608047301,2018-08-19,42.70669,23.321758,Hotel Favorit,100,Staff is very good. Position is not so bad (near Central station e Metro station). Rooms are clean and breakfast is good also. We had problem with air conditioning every day. But i inforremd every time reception and immediately solved problem. To be suggested,Good hotel,788080243C4415B65D8E3F4F976FAB65
review_636576431,2018-11-29,42.69403,23.324863,Grand Hotel Sofia,80,"I have been there only on business talks and team buildings but as far my impression is that the hotel is clean and the staff nice. They are organised and polite. Only thing I don't like is their catering on business events, but this could always be improved.Traveller-friendly location as it is right next to the city garden and the National Theatre as well as close to some other major sights.",Looks good,74FF334F76955126043AD5FD83DB5B69
review_635949956,2018-11-26,42.69403,23.324863,Grand Hotel Sofia,80,"An elegant, clean and beautiful hotel, located in the center of Sofia with excellent service and friendly staff. Close to main landmarks and attractions. Would recommend for everybody who would like to have a relaxing and enjoyable stay in the hearth of the Bulgarian capital.",A night in the center of Sofia,AFFCDA434B98C64021A1CCC6A75EA18E
review_635543721,2018-11-25,42.69403,23.324863,Grand Hotel Sofia,80,"The rooms here are huge and very comfortable. The Shades of Red restaurant serves excellent food and the Grand Cafe is a pleasant place to sit. The lobby bar service was a bit poor, as was breakfast and dinner in the restaurant when staff gave precedence to groups. The concierge wasn’t overly helpful. The reception staff were very helpful when taxis were in short supply and I was in danger of being late for the opera - they offered the hotel car. So, a mixed bag, but on the whole a good experience.",Traditional hotel in great location,F7E13C43E11BB8CF2E1B80E2CF4A7217
review_635272397,2018-11-23,42.69403,23.324863,Grand Hotel Sofia,80,"This hotel has the best location in Sofia for tourist, and it has probably the largest room too. The breakfast is good and it has free valet parking. It is probably the best hotel in Sofia for tourist",Best hotel in Sofia although it has no swimming pool,CFC63406044800F368DD9D8330CFBAC1
