id,date,lat,lng,name,score,text,title,user
review_611808801,2018-08-29,42.697353,23.328375,Arena di Serdica Boutique Hotel,100,"Real 5 stars hotel in Budapest street which is in heart of Sofia. Highly recommended if you are on Business trip or just to discover beauties of Sofia. Tje bed and equipments are just fantastic, on top the L'Occitane things (shampoo, shower gel, soap, etc). Personally i love it. And staff is very flexible and nice. Good choice. Breakfest is brilliant.",Budapest,C62CF26F724AB8D05591C4A829EDCB6D
review_611088155,2018-08-27,42.697353,23.328375,Arena di Serdica Boutique Hotel,100,"Just spent the one night but would certainly return to this hotel.Our room was spotless, very well appointed, bathroom was luxurious with a large soaker tub, comfy beds, and within easy walking distance of sights including St. Alexander Nevsky Cathedral.We were there for the Sunday morning breakfast - and the hot and cold selections had something for everyone. Lovely breakfast room and the breakfast choices were well displayed and labeled in English.Did not use the Wellness Center so can’t comment on that.",Great place!,848FA85693E3A2F62ABD966862832C99
review_606889235,2018-08-15,42.697353,23.328375,Arena di Serdica Boutique Hotel,100,"Awesome location . . Definitely recommend to stay here. Close to all main square.Remarkable breakfast. Don't leave the hotel without trying their breakfast, very impressed with the selections. Friendly staff members",Great stay,63B62076A62EDB1DB1B72ED1C8638339
review_603388841,2018-08-06,42.6919,23.316511,Canape Connection Guest House,80,"Really nice guest house in the center of Sofia. Super easy to get to from the airport via public transportation and within walking distance of everything. The people here are soooo nice!! We enjoyed chatting and learning more about Sofia and Bulgaria in general. The only downside is that if you stay in the winter, there is no central heating, so the basement rooms are really cold. They do have a space heater to take the edge off but I wouldn't stay in the basement rooms in the winter. Other than that, it was a really nice place and affordable too.",Homey Guest House in the Heart of Sofia,0F5D252480B358E8ADD1FC1A162378A7
review_592560422,2018-07-02,42.6919,23.316511,Canape Connection Guest House,80,"Stayed here for 2 nights at end of June. Originally booked for one night but they were able to let us have the room for a second night too!Great Location - just a few metres from the pedestrian boulevard where there are lots of nice bars and restaurants!Great Hospitality - lovely hosts who were very knowledgable about the tours available for travellers!Facilities - Good showers, lovely warm water! Very clean hostel and access to kitchen for cooking/breakfast.Overall, a lovely couple of nights here! Definitely recommend for travellers looking for a quality hostel!",Great Location and Excellent Facilities,FD2D3431CBF69F271C8C4B878C25188F
review_591076209,2018-06-27,42.6919,23.316511,Canape Connection Guest House,80,"Stayed for two nights at the beginning of my trip to Bulgaria, and liked it enough to come back and spend two more nights at the end. Had different rooms, and both were clean and comfortable - had a really excellent night's sleep! Staff were extremely helpful and friendly, although the lack of a reception desk was slightly inconvenient. If you needed anything they were always easy to phone though. The place is clean and secure, with all the essential facilities. Kitchen is small but has the basics. Outdoor table in the courtyard is a lovely place to sit and have a drink. Only a few other guests about to socialise with, so the atmosphere was quite quiet, but it was overall a lovely place to stay.","Great location, comfortable beds!",C96DDDE8E8DEE22D1F4AB6CBB4970977
review_560292694,2018-02-13,42.6919,23.316511,Canape Connection Guest House,80,"Very friendly staff. Has everything you need and many unexpected extra's like great tips on what to do in Sofia, nice fresh coffee, a computer you could use and so much more.Definitly recommending this to friends and family!Cozy, clean and very close to the city center.They don't 'serve' breakfast, but they do put foods in the kitchen for the visitors to use for free. They also provide free clean towels",Amazing hostel,F7F95A3BC313B1038AA70AE84434C562
review_558510681,2018-02-04,42.6919,23.316511,Canape Connection Guest House,80,"Everything was perfect. Warm welcome, WIFI, close to city center, clean.We had only two days in Sofia but thanks to the good location and all the advises of the team, we had time to make an amazing Free Sofia Tour and to try some Bulgarian foods specialities in cheap restaurants nearby.I strongly recommand it !",Cozy hostel in city centre,5B203CCE84312E37A0922786AE838EFA
review_535049168,2017-10-22,42.6919,23.316511,Canape Connection Guest House,100,"This hostel was outstanding from start to finish. Canape Connection is not your typical hostel in that it does not have a traditional reception etc. Instead, you are personally welcomed. It is very small in that it has just a handful of rooms, but my room itself was huge, had good storage, a heater and a very comfortable bed. The bathroom and kitchen facilities were also clean and tidy.Location-wise, it is 2-3 minutes walk off Vitosha Boulevard. I walked the city from this base and it was no bother. Sofia has a large public transport network, too.As is the norm in Bulgaria, I was asked to pay in cash on arrival. This my seem a little strange to anyone from a country where contactless cards have become the norm, but it isn't in Sofia.I received some recommendations from my host and all of these turned out to be good, too.All in all, I'd thoroughly recommend this hostel.",Perfect place to stay for the solo traveler,C72871548BAAC5568E60A8DCE02B1003
review_528528982,2017-09-30,42.6919,23.316511,Canape Connection Guest House,100,"This cozy hotel is super close to the center, only a 2 minutes walk from Vitosha Boulevard. There is also a market and a bakery closeby. We stayed in a double room in the basement (65 Leva/room via Booking). The room was decorated so lovely, personally touched. There is a nice garden where you can enjoy your breakfast. Cooking equipments and common materials like spice, oil are available in the kitchen.The staff is wonderful! Senay actually spend quite amount of time to tell us where we can visit, where we can eat, where is the market, exchange office etc. They even let our motorbike to park inside of the yard which blow my heart :) I would definitely recommend !",Cozy and peaceful hostel super close to city centre,FAB229071AF92DA60866F850D05DF07E
review_528329639,2017-09-29,42.6919,23.316511,Canape Connection Guest House,100,"They advertise as a hostel on sites, but it is more like a guest house. I really enjoyed my stay. Staff was so nice! Even got a nice homemade salad with fresh tomatoes.The room was spacious. The shared toilets and bathrooms were very clean and tidy. The location is great, a lot of opportunities to have breakfast/dinner nearby and also close to public transport.",Very good guest house!,46BB0BD6DE540C78E61DCA1AD96D4A00
review_500498834,2017-07-10,42.6919,23.316511,Canape Connection Guest House,100,We went to this hostel on our rugby tour! As it was a group trip I'm not sure of the price. We rented out all but 1 of the rooms. So it's a fairly small hostel! There is a mix of rooms with single and double beds. In the attic there is a dorm room with about 4 single beds and 1 double.I really enjoyed our stay there. It was clean. Very close to the city centre too. A 2 minute walk took you to some food shops! You could make tea or coffee. I'd definitely recommend if you were considering a stay in Sofia!,Lovely Hostel,396657C3D7FB2D9C687AD753C299CBEA
review_493458230,2017-06-16,42.6919,23.316511,Canape Connection Guest House,100,"Had a bit of a shenanigan with our taxi drivers so arrived late in the night but we were still welcomed with a smile. The top room for many people is spacious, clean and comfortable.The building is exactly what you want from a hostel - fun and relaxing.","Warm welcome, clean and relaxing.",2C85F3941F70C576090773650071D976
review_636807187,2018-12-01,42.65699,23.38308,Metropolitan Hotel Sofia,40,"Nice hotel, good location, facilities(near airport and mall). But disappointed by staff and service. First, i was charged upfront(blocked the money in my account) for my stay but double the amount. When asked why, they said in case i buy something during stay. They gave me the option to pay the correct amount on the first day!! As if!! I complained about a/c because its was blowing cold air (outside it was -5). After several calls to the reception they said they would send someone to fix it. After an hour they gave me a hot air portable machine!!!In the price, the airport shuttle to and from the hotel was included. I booked a month before my stay and i forgot that. Nobody notify me on the day of my arrival. I asked for the shuttle for the transportation to the airport and they said is 5 euro. I asked why. They said its because i would use it after check out !!!! On the day of my departure they said it would be complementary free!!!! Whatever!! Look elsewhere.",Not very happy,805E2F1DF673E9F870A1992B54C0F5CF
review_635836694,2018-11-26,42.65699,23.38308,Metropolitan Hotel Sofia,40,"The hotel ended up being perfect for our business trip! Very good management with friendly and helpful staff. The breakfast was tasty and our room had free mini bar, which was refreshed daily. Definitely recommend the hotel for business trips!",Very good experience!,D85126A7F10F4E71FE0FDDA1F1B9ACCC
review_633683054,2018-11-15,42.65699,23.38308,Metropolitan Hotel Sofia,40,"I was visiting Sofia for three days and spent two evenings at The Metropolitan Hotel.It is a short ten minute taxi drive from the airport and is located on the outskirts of Sofia.The hotel is 10 years old and so has modern facilities and is clean and bright.My room was clean, warm and spacious.I are in the restaurant on the first night and then in the bar on the second as the restaurant was closed for a private function.The food was good as were the local beers - and all comparatively cheap compared to the UK.The breakfast offering was generous - a wide range of cold meats, salads, breads, cereals, yoghurts and a hot buffet.The cost of two nights bed and breakfast and two evening meal came to £210 - so excellent value for money.","Modern, spacious hotel on outskirts of Sofia - good rooms, secure parking and free wi-fi",6E8F1532C19A814863FDD98C1A81FBA2
review_629018061,2018-10-27,42.65699,23.38308,Metropolitan Hotel Sofia,40,"As usual, find me a place to get my head down before my ridiculously early flight. Where this time? Let’s try the Metropolitan. I remember them building this so I thought why not.I normally like to try out of the way places but this time - just give me somewhere handy.Impressive looking just off the main drag. Family room for 3 £75 including complementary mini bar!Very well styled room and hotel generally - bathroom nice and nice comfy bed - what more do you need?We didn’t dine but the menu looked extensiveAdded bonus - free airport shuttleAll in all would recommend and stay there again",Local for airport,9AB82EF0C515C22B69552EA13AD71FAD
review_627034173,2018-10-21,42.65699,23.38308,Metropolitan Hotel Sofia,40,"I would look elsewhere, employees not very friendly. i was charged for my stay up front, first time that has ever happened. When i got to room, it was very hot, i tried setting the ac and was told ""its not possible, since they had switched to winter. I have never heard of that one before. The hotel claims the staff speaks English but they barely understood. Room service sucked, food would come up to the room luke warm and no serving cover. Some items were not avail on the menu. You have to keep the key card in the slot for electricity. So i improvised and put a business cars in there, when i got back the cards were removed and thrown out, so items i had left to charge would not stay charged.The only thing that was good was the breakfast buffet.Do yourself a favor and look elsewhere.",Look elsewhere,EBCE7E499CBB6BBA33F01793D0A55647
review_623474162,2018-10-09,42.65699,23.38308,Metropolitan Hotel Sofia,60,"The Metropolitan Sofia is a hotel as all Metropolitans. That is obviously one of its strengths, but a weakness at the same time. It does not have a great own identity. But its of good quality. Kitchen is absolutely good. Staff is very friendly and well trained. The neighborhood is not very inspiring (rather Soviet style?)?. But taxi's to the center of town are relatively cheap.","Good hotel, friendly staff.",3AC89FD6EAD8D91853467CDE5D9C34AA
review_621909541,2018-10-03,42.65699,23.38308,Metropolitan Hotel Sofia,60,"It was a two nights stay for a business trip. I got all I expected from a business hotel. The breakfast buffet had a wide choice of food, but the dinner menu card in the restaurant was a bit restricted. I had a beefsteak that came as ordered (medium), but the sauce (green pepper) was more like a stripe of stain on my plate, altough it tasted good. When finished, the waitress came right away and asked if I wanted anything elsem and when I said no, se immediately told me she would bring the bill then. It felt as if she wanted me to leave asap.","Great location, huge room",CB5D2F955F24FF475FFA7CD47591D8F8
review_621133834,2018-10-01,42.65699,23.38308,Metropolitan Hotel Sofia,60,"This nice hotel is one which I always choose when comming to Sofia. It is close to airport, close to office and very close to my favorite restaurant Happy. Vera nice place with great breakfast, comfort rooms.",Nice place to be,36233EA1A9A2708294184E1A7D5B1008
review_619618106,2018-09-25,42.65699,23.38308,Metropolitan Hotel Sofia,60,"It is a very good hotel especially if you have a car. It is in a convenient location,quiet if you stay at the back ,with a big parking. The rooms are very big , clean and cosy. The restaurant is warm and looks like a luxurious one. No e breakfast with a big selection of food. The stuff very kind and helpful. It is worth visiting. We will gladly stay there again.",Wonderful,7BB0559CE58A0ED1F0EC182C4C6814C3
review_618102786,2018-09-19,42.65699,23.38308,Metropolitan Hotel Sofia,60,Good and polite staff . There’s a mall shopping center near the hotel (almost 300 meters walk ). I felt comfortable while my stay there. Also good access to the airport every 30 minutes by free shuttle (10minutes drive). Great breakfast and free mini bar. [ Alex at the Metbar is a pro :) ],Hotel metropolitan,F95AF6245F460F8A7F6F0BC9B68C7F6F
review_624701003,2018-10-14,42.699097,23.332262,City Hotel,100,The hotel was in a very walkable area of the city centre. There were newly discovered ancient ruins (the city was building a new subway) as well as a fantastic pedestrian walkway with many shops and cafes. The rooms were very nice with king size beds and coffee in room. A delicious buffet breakfast was included. Many eateries in the immediate area.,Sofia Business travel,720E7468D85FCA7DE53E93D7CDE8118A
review_622540891,2018-10-05,42.699097,23.332262,City Hotel,100,"Nice rooms, some quite small. Good sized modern bathrooms with bath and shower. Breakfast was fabulous with fruit, hot dishes and everything you could expect. Don't miss the banitsa! It's an easy walk to the pedestrianised shopping street and the metro station. We had dinner there one night. It was ok, not great. Service was good.",great breakfast,537F589E95A90345344ECF003B5CB582
review_621679733,2018-10-02,42.699097,23.332262,City Hotel,100,"The rooms are large and quiet, the cleanliness excellent, breakfast is copious. The staff is courteous and helpful, female staff that is. Like elsewhere in Bulgaria most males are rough, hard to get ""good morning"" from them, even when you take the initiative to say it first. As compared to other hotels in Bulgaria on this trip this one rated well. Hotels were generally roomy, but service was sparse.","Very pleasant hotel, well located",A1CE586DAC292F6FB532217C4CAED1A3
review_620519217,2018-09-29,42.699097,23.332262,City Hotel,100,"Excellent! Very, very clean. Very modern. Typical twin beds for a couple. Bathroom a little tight but very modern and immaculately clean. Breakfast was wonderful. Vast array of choices and all delicious.",Road's Scholar tour hotel,32BD39E92B345F1D1015300896C6A3A7
review_619621557,2018-09-25,42.699097,23.332262,City Hotel,100,"Located approx. 30 mins. drive from SOF airport. Hotel offers shuttle, which we would have used if we knew.The City hotel is not in the city centre, but it does not take long to go there by tram, by foot or taxi. You are a few minutes from the Nevski cathedral. There are a few takeaways, kiosks and 2 cafees near the hotel.The hotel has 2 wings, A+B. Small lobby area with lobbybar, sitting area outside. Ground floor offers meeting facilities, business centre (PC and printer) and Italian restaurant with indoor and outdoor seating. No bellboy service.Allthough requesting a high floor We were located in the B-wing on the 1st floor. Good size room, carpeted, comfy doublebed, clean linnen, Sat.TV, minibar, safe, coffee/tea&kettle. Even the aircon was off, cold air was coming out which made me freeze during the night. (extra downs provided). Bathroom of good sized, Tub was really tall and not easy to get in and out if you are an older person. Waterpressure a bit wobbly. Lights at the mirror could be improved. Room cleaned everyday, cleaning staff seemed friendly, but shouting in the corridors and slamming doors when trying to rest.Wifi worked fine everywhere, and the hotel was clean.Breakfast served from 7am with cold and hot items, all fresh and well prepared. Unfortunately the coffee is not good and 1 machine is not enough when the place is busy. We had a few dinners in the restaurant, all fresh and well prepared. Prices high scale, but still prices in Sofia are quite reasonable. As a diamond client we had 10% off the restaurant bill. Some days we were able to add the bill on the room, some days not!? One evening there were a private party in the restaurant, which meant that we could not use the courtyard or the restaurant, but we could hear the loud music until midnight in our rooms. Travelling with my elderly mother it would have been nice with a warning.We did find staff friendly and helpful, but would probably choose another hotel next time when in Sofia.",Good stay,B9B81FF78ECACF7BF6DD073CF7CFDDF5
review_614005901,2018-09-05,42.699097,23.332262,City Hotel,100,"We stayed there for one night and everything about this hotel was great. The room is nice and comfy. The bathroom is brand new, clean and fresh. The staff is super helpful especially Margaret. The breakfast is outstanding and the location is perfect.",Excellent all in all,2BF09E0D89E72A9126DAF7D26F6B60DC
review_612661869,2018-08-31,42.699097,23.332262,City Hotel,100,"stayed for one week in mid august. Our room was very clean, seems it was updated not long ago (as some other parts of the hotel, while we were there), a big room with plenty of space, housekeeping was great - and gave us anything we needed. good breakfast with a lot of variety (bad coffee - but the same as at other places in Sofia).we ate at the Italian restaurant inside the hotel almost every night, and it was delicious :)The staff at the front desk were ok, the hotel not located at the city's center - but that was ok for us.",wow! wow!,ABF59AD9DDC8A000305CD4EE879810FE
review_606100738,2018-08-13,42.699097,23.332262,City Hotel,100,"I don't like to leave negative posts at all but this was a real disappointment to our start in beautiful Bulgaria.The poor service and disappointment started at the front desk - they couldn't find our reservation and when they did, we had booked and paid for a deluxe/superior room. We were put in a room which was definitely not like the superior or new rooms in the pictures. We were told the only difference was the toiletries - this was clearly not the case.The bathroom was shabby. The shower was broken off the wall and the tiles cracked.The hotel lobby is in the middle of being updated, there are bags of cement and dust sheets everywhere.The breakfast was good and plentiful though!Really sad to have to have written such a negative review when others seem to have had a good experience - but our stay and the way we were treated really did leave a sour taste.I wouldn't stay here again and would think twice about Best Western again now.",Pretty disappointing on every level,4A90583C2CF8C6779DB247395B40972D
review_605581615,2018-08-12,42.699097,23.332262,City Hotel,100,The City Hotel is located just 5-minutes walking from Alexander Newsky Cathedral and 10-minutes walking from the city center. Hotel is modern and staff is really professional and helpful. Private parking available next to the hotel or other public parking just outside the entrance.My room was not so big but comfortable and clean.Breakfast was quiet good even if not exactly as per 4 Stars hotel.In the average a good hotel not so far from the city center.,Good hotel,58FD1DF51063D13BE3A403CB783FEFD2
review_603621636,2018-08-06,42.699097,23.332262,City Hotel,100,"The hotel is modern, the rooms are very confortable and clean. The bed and pillows were so good!The staff is very friendly and helpfull. The breakfast was good, with variety and different options.The location is amazing!!! You are 2 min walking to the Aleksandar Nevski Cathedral (as soon as you leave the hotel you see the cathedral on top of the street) and also 1 min from coffeeshops, restaurants, Atm, supermarkets.The hotel is perfect to visit Sofia because it is central and very near to the monuments, museums and main streets/areas.You can also reach vitosha boulevard in just 10 min walking . We didn't use the subway during our stay because everything is near the hotel in walking distance.The hotel is very quiet, no noise in the street or inside the hotel.A perfect choice if you are traveling to Sofia!the entrance of the hotel","Location, location, location!",9881785FBCCE1241669C6CD8A6447A77
review_631643585,2018-11-07,42.702946,23.32521,Hotel Light,80,"It was the 2nd time I stayed here and I'm happy with this hotel. It's at walking distance from the centre, in a quiet street. It's very clean and the wifi and breakfast buffet are great. The rooms are basic but large enough!",Lovely and affordable hotel very close to the centre!,3ADE1EA5540338760A92E8254E60446A
review_617310329,2018-09-17,42.702946,23.32521,Hotel Light,80,"... But we were traveling to the Black Sea.In a quiet place, although not very far from the center city, this well equipped hotel, offers all means (and even more) what you can expect of an hotel of this category to feel good.We specially enjoyed the panoramic lift, the fitness room and the very correct breakfast.",We would have liked to stay longer...,CCB85A7B69B91F56875C63BC7E814270
review_614566289,2018-09-07,42.702946,23.32521,Hotel Light,80,Great hotel in an area which is a bit rundown but safe. Only minutes walk from the very centre of town and the bar/minibar prices cannot be faulted. Don’t book an airport transfer however as the pre-booked airport taxis are cheaper.,Spotlessly clean,B0F6429E0A1979C5B044C55F4F1DDD71
review_613893532,2018-09-04,42.702946,23.32521,Hotel Light,80,"We had a 2 floor apartment and I liked that a lot. our children had a big fun on the strairs which were covert by a carpet. The beds were very comfortable too.I also liked the view from the balcony.Breakfast was quite ok as well.Hotel is located in my opinion around 5-10 minutes from the CityCentre, They have a parking slot for the cars, but you need to reserve it.on the side which probably they will improve soon as the gat was pretty new when we came: The parking is private and closed with the gate, this makes a big trouble to get out from parking and you need to call reception to open the gate. I think they will improve it over time and it will be even better.",Very Good,D179687637C62A8E6D417B0A6EA12470
review_613242217,2018-09-02,42.702946,23.32521,Hotel Light,80,"Stayed there 3 nights in August 2018:I had a nice room with views in the 5th floor, room was clean, everything was working, breakfast buffet good and the staff was friendly and helpful. In opposite to many other accommodations in Bulgaria there was a separate shower cabin in the bathroom. The hotel is in a quiet side street between the train station and the city centre. I slept very well and could not complain at all. What do you want more?",Nice business hotel in good location,43422F1C746A95644156E8CDAFE259B3
review_612785759,2018-09-01,42.702946,23.32521,Hotel Light,60,Light hotel is a modest hotel in the city of Sofia.it is close to the city centre and vitosha square. it is also close to the bus/train station on foot approximately 15 min for both of these places.rooms are normalbreakfast was descent with the most frequent choicesstaff was ok,city break,F7CC145B59F7E1DEEE9F535109992F1F
review_591704860,2018-06-29,42.702946,23.32521,Hotel Light,60,"My wife and I stayed here for three nights. It was our base to see the museums and sights of Sofia. We had no complaint at all. The staff was friendly, the breakfast was fine, everything worked in the room and it was clean. What more could one want for a quick tour.",Great place to stay to see old Sofia,AC2266B0C2545EC40C778EAD320EA12F
review_591241738,2018-06-27,42.702946,23.32521,Hotel Light,60,"The room was always clean and the staff was accommodating. However, our last night was awful since there was a party in the lobby until 1.30AM. Another problem: no double duvet, me and my partner had to sleep far away from each other!",Positive and negative altogether,8790BC622FF4DB35245589CF09BB0BEF
